{
  "definitions": {},
  "$schema": "http://json-schema.org/draft-07/schema#",
  "$id": "http://example.com/root.json",
  "type": "object",
  "title": "The Root Schema",
  "required": [
    "felles",
    "førstegangsbehandling",
    "revurdering",
    "endringssøknad",
    "død",
    "klage"
  ],
  "properties": {
    "felles": {
      "type": "object"
    },
    "førstegangsbehandling": {
      "type": "boolean"
    },
    "revurdering": {
      "type": "boolean"
    },
    "endringssøknad": {
      "type": "boolean"
    },
    "død": {
      "type": "boolean"
    },
    "klage": {
      "type": "boolean"
    },
    "søknadDato": {
      "type": "string"
    },
    "fristDato": {
      "type": "string"
    },
    "dokumentListe": {
      "type": "array"
    }
  }
}
